Username,Tweet
NatalyaCro25747,namun dengan segudang informasi tersebut masih banyak publik yang salah kaprah atau bahkan belum tau dengan gagasan dan ide dari bapak yg sudah 4 kali ikut pemilu tersebut. #PrabowoNeruskePakdhe Prabowo Subianto #PrabowoMenjagaKerukunan
SullivanMc94854,"Oleh sebab itulah menurut prabowo, dunia harus belajar pada tradisi asia, yaitu kompromi. #PrabowoNeruskePakdhe Prabowo Subianto #PrabowoMenjagaKerukunan"
NatalyaCro25747,"Pidato, ide, pikiran dan gagasannya sering wara-wiri di media cetak, televisi dan internet, #PrabowoNeruskePakdhe Prabowo Subianto #PrabowoMenjagaKerukunan"
brendskienavarr,"Delegasi kami dari sektor swasta juga melaksanakan pertemuan dengan sektor swasta Indonesia dan pertemuan ini berjalan dengan sangat baik,"" katanya. #PrabowoNeruskePakdhe Prabowo Subianto"
SullivanMc94854,"Sebagai contoh Prabowo memisalkan konflik Ukraina- Rusia yang terjadi diawal 2022 telah merusak rantai pasokan global, menciptakan kemiskinan dan kelaparan di tingkat global. #PrabowoNeruskePakdhe Prabowo Subianto #PrabowoMenjagaKerukunan"
brendskienavarr,Kami diterima dengan sangat baik dalam kunjungan ini oleh Presiden RI Joko Widodo. #PrabowoNeruskePakdhe Prabowo Subianto
brendskienavarr,"""Saya menikmati pertemuan yang dilaksanakan bersamaan dengan makan pagi ini dengan Menhan RI Prabowo Subianto. #PrabowoNeruskePakdhe Prabowo Subianto"
brendskienavarr,Shtayyeh mengapresiasi komitmen Indonesia yang solid untuk rakyat Palestina serta memperjuangkan hak-hak Palestina dalam menentukan nasib sendiri. #PrabowoNeruskePakdhe Prabowo Subianto
brendskienavarr,"Sementara itu, PM Mohammad IM Shtayyeh mengucapkan terima kasih atas sambutan dalam kunjungan kenegaraannya. Dia juga berterima kasih atas kerja sama Indonesia demi meraih perdamaian dunia dan di Palestina. #PrabowoNeruskePakdhe Prabowo Subianto"
brendskienavarr,"Adapun dalam pertemuan itu, Prabowo dan PM Shtayyeh turut membahas perkembangan situasi global. Prabowo juga menyampaikan komitmen RI dalam membantu rakyat Palestina. #PrabowoNeruskePakdhe Prabowo Subianto"
brendskienavarr,"""Hal ini adalah bantuan konkret untuk mempersiapkan masa depan bangsa Palestina. Kami percaya bahwa pada akhirnya rakyat Palestina akan meraih tujuan-tujuannya,"" kata Prabowo. #PrabowoNeruskePakdhe Prabowo Subianto"
brendskienavarr,Prabowo mengatakan beasiswa ini merupakan bentuk konkret keberpihakan Indonesia kepada rakyat Palestina. Prabowo meyakini rakyat Palestina akan meraih tujuannya. #PrabowoNeruskePakdhe Prabowo Subianto
brendskienavarr,"""Kami juga menawarkan beasiswa di tingkat SMA berasrama (boarding school) serta sekolah-sekolah militer lainnya untuk anak-anak muda Palestina,"" ujar Prabowo, dalam keterangan resmi, Rabu (26/10/2022). #PrabowoNeruskePakdhe Prabowo Subianto"
brendskienavarr,"Dalam kesempatan itu, Prabowo menawarkan beasiswa bagi anak-anak Palestina di Universitas Pertahanan RI untuk belajar ilmu kedokteran, farmasi, hingga matematika. #PrabowoNeruskePakdhe Prabowo Subianto"
brendskienavarr,"Diketahui, kerja sama ini merupakan tindak lanjut dari kunjungan Perdana Menteri (PM) Palestina Mohammed Ibrahim Shtayyeh di Kementerian Pertahanan RI, Jakarta Pusat, akhir tahun lalu. #PrabowoNeruskePakdhe Prabowo Subianto"
brendskienavarr,"Nilai persisnya akan dicek, pokoknya yang akan ikut program kita sesuai dengan kurikulum kita dengan standar yang sudah kita tetapkan bersama anak-anak kita,"" ucapnya. #PrabowoNeruskePakdhe Prabowo Subianto"
brendskienavarr,"""Untuk tahun ini kita lihat perkembangan, harapannya bisa tiap tahun dan ini adalah penuh, termasuk biaya hidup. #PrabowoNeruskePakdhe Prabowo Subianto"
brendskienavarr,"Beasiswa yang diterima adalah beasiswa penuh yang mencakup seluruh komponen, dari biaya hidup hingga kebutuhan pembelajaran. Prabowo berharap program maupun kerja sama dengan pemerintah Palestina berkelanjutan. #PrabowoNeruskePakdhe Prabowo Subianto"
brendskienavarr,"matematika dan ilmu pasti alam, kimia, biologi, fisika. (Bidang) teknik ada teknik sipil dan sebagainya, kedokteran dan farmasi,"" jelasnya. #PrabowoNeruskePakdhe Prabowo Subianto"
brendskienavarr,"""Programnya tahun ini kalau tidak salah 22 tempat, 22 pemuda pemudi Palestina yang akan diseleksi oleh Palestina dengan Unhan di bidang kedokteran, farmasi, teknik dan MIPA, #PrabowoNeruskePakdhe Prabowo Subianto"
brendskienavarr,"Nantinya, Unhan dan pemerintah Palestina akan melakukan seleksi untuk menjaring 22 siswa dan siswi beruntung penerima beasiswa. Program studi yang ditawarkan mulai dari teknik sipil, kedokteran, hingga rumpun MIPA. #PrabowoNeruskePakdhe Prabowo Subianto"
brendskienavarr,"di mana kerja sama ini meliputi beasiswa untuk pemuda pemudi Palestina untuk menjadi adat siswa di Unhan,"" kata Prabowo di kantor Kementerian Pertahanan, Jalan Medan Merdeka Barat, Jakarta Pusat, Senin (19/6/2023). #PrabowoNeruskePakdhe Prabowo Subianto"
brendskienavarr,"""Pada hari ini baru saja kita saksikan bersama penandatanganan kerja sama antara rektor Universitas Pertahanan dengan Palestina, #PrabowoNeruskePakdhe Prabowo Subianto"
brendskienavarr,"Adapun penandatangan dilakukan oleh Rektor Unhan Laksamana Madya TNI Amarulla Octavian dengan Duta Besar (Dubes) Palestina untuk Indonesia, Dr. Zuhair. #PrabowoNeruskePakdhe Prabowo Subianto"
brendskienavarr,Menteri Pertahanan (Menhan) RI Prabowo Subianto menyaksikan langsung penandatangan kerja sama di bidang pendidikan itu. #PrabowoNeruskePakdhe Prabowo Subianto
brendskienavarr,Penandatangan kerja sama kedua belah pihak digelar pada Senin (19/6/2023) di Aula Bhinneka Tunggal Ika Gedung Sudirman Kementerian Pertahanan RI. #PrabowoNeruskePakdhe Prabowo Subianto
brendskienavarr,"Nantinya, kerja sama ini akan membidik 22 pemuda Palestina untuk menerima beasiswa penuh buat belajar di Unhan. #PrabowoNeruskePakdhe Prabowo Subianto"
brendskienavarr,Jakarta - Universitas Pertahanan RI (Unhan) resmi menandatangani perjanjian kerja sama di bidang pendidikan dengan pemerintah Palestina. #PrabowoNeruskePakdhe Prabowo Subianto
brendskienavarr,Prabowo Beri Beasiswa 22 Pemuda Palestina Belajar di Unhan https://t.co/i0H95lLOKE #PrabowoNeruskePakdhe Prabowo Subianto
ValeryGrif59163,Kompromi adalah upaya untuk mendapat kesepakatan dari setiap pihak yang memiliki perbedaan pendapat atau selisih paham. #PrabowoNeruskePakdhe Prabowo Subianto #PrabowoMenjagaKerukunan
HugaryYate74872,Kompromi adalah upaya untuk mendapat kesepakatan dari setiap pihak yang memiliki perbedaan pendapat atau selisih paham. #PrabowoNeruskePakdhe Prabowo Subianto #PrabowoMenjagaKerukunan
SullivanMc94854,Kecilnya planet ini membuat setiap konflik yang dilakukan oleh dua kelompok yang bermusuhan selalu memberi dampat bagi semua tatanan kehidupan yang ada di diplanet tersebut. #PrabowoNeruskePakdhe Prabowo Subianto #PrabowoMenjagaKerukunan
HugaryYate74872,"Oleh sebab itulah menurut prabowo, dunia harus belajar pada tradisi asia, yaitu kompromi. #PrabowoNeruskePakdhe Prabowo Subianto #PrabowoMenjagaKerukunan"
Harumiii_kn,"Selain berkinerja moncer, Igor menuturkan alasan adanya sinyal dukungan Jokowi kepada Prabowo-Erick karena keduanya memiliki elektabilitas yang tinggi.  #PrabowoNeruskePakdhe Prabowo Subianto"
Harumiii_kn,"“Contohnya, Indonesia menjuarai sepak bola di SEA Games kemarin begitu,” sambungnya.   #PrabowoNeruskePakdhe Prabowo Subianto"
Harumiii_kn,"“Artinya peran Pak Erick Thohir dalam memajukan persepakbolaan Indonesia itu sudah kelihatan kinerjanya, padahal baru terpilih beberapa bulan lalu.”  #PrabowoNeruskePakdhe Prabowo Subianto"
Harumiii_kn,"Sementara dari Erick Thohir sendiri, lanjut Igor, kepercayaan Presiden Jokowi kepada menteri BUMN itu sulit dibantahkan.  #PrabowoNeruskePakdhe Prabowo Subianto"
Harumiii_kn,"“Pak Jokowi makan siang tuh dengan Pak Prabowo dan Pak Jokowi mengakui dia membahas politik,"" #PrabowoNeruskePakdhe Prabowo Subianto"
Harumiii_kn,"Belum lama ini, kata Igor, Prabowo berkesempatan makan siang bersama Presiden Jokowi di Istana Bogor pada Ahad (18/6) yang diakui membahas soal politik.  #PrabowoNeruskePakdhe Prabowo Subianto"
Harumiii_kn,"Terlebih, Igor melihat sikap tegak lurus Prabowo kepada presiden yang secara konsisten mendukung dan berkomitmen untuk melanjutkan program pemerintahan Jokowi.  #PrabowoNeruskePakdhe Prabowo Subianto"
Harumiii_kn,"“Nah dalam momentum pertandingan Argentina melawan Indonesia artinya Pak Jokowi juga mengendorse Erick Thohir sebagai cawapres,” ucapnya  #PrabowoNeruskePakdhe Prabowo Subianto"
Harumiii_kn,“Indikasi kuat kalau endorsement Pak Jokowi itu ke Prabowo-Erick. Kalau Pak Prabowo itu kan jatah presiden statement di ulang tahun Perindo.”  #PrabowoNeruskePakdhe Prabowo Subianto
Harumiii_kn,"“Mereka memisahkan antara politik dan olah raga. Ini yang diapresiasi oleh Presiden Jokowi,"" Lanjut Igor, pada laga yang menjadi sorotan banyak masyarakat tersebut  #PrabowoNeruskePakdhe Prabowo Subianto"
Harumiii_kn,"""Prabowo-Erick nggak pernah tolak Israel untuk berlaga di Piala Dunia U-20 kemarin yang akhirnya batal digelar di Indonesia.”  #PrabowoNeruskePakdhe Prabowo Subianto"
Harumiii_kn,Hal itu tercermin dari sikapnya yang tegak lurus dengan arahan Presiden Jokowi pada momentum Piala Dunia U-20 tahun 2023.  #PrabowoNeruskePakdhe Prabowo Subianto
Harumiii_kn,"Selain itu, Igor juga menilai Prabowo-Erick memiliki komitmen yang kuat untuk memajukan sepakbola nasional.  #PrabowoNeruskePakdhe Prabowo Subianto"
Harumiii_kn,"Hal tersebut dilakukan demi muncul bibit unggul di dunia sepakbola Tanah Air,"" ujar Igor, Rabu (21/6).  #PrabowoNeruskePakdhe Prabowo Subianto"
Harumiii_kn,"Igor melihat adanya chemistry antara Prabowo dan Erick Thohir. Sebab, keduanya merupakan tokoh yang mencintai olahraga, khususnya sepakbola.  #PrabowoNeruskePakdhe Prabowo Subianto"
ParksNatha6733,namun dengan segudang informasi tersebut masih banyak publik yang salah kaprah atau bahkan belum tau dengan gagasan dan ide dari bapak yg sudah 4 kali ikut pemilu tersebut. #PrabowoNeruskePakdhe Prabowo Subianto #PrabowoMenjagaKerukunan
Harumiii_kn,"Keduanya pun kompak memakai jaket warna merah, sementara Presiden Jokowi dan Ibu Negara mengenakan pakaian warna putih.   #PrabowoNeruskePakdhe Prabowo Subianto"
Harumiii_kn,Dalam momen itu Prabowo dan Erick tampak mesra duduk sejajar menemani Jokowi.  #PrabowoNeruskePakdhe Prabowo Subianto
Harumiii_kn,Sinyal Arah Dukungan Jokowi Makin Terlihat saat Laga Indonesia vs Argentina  #PrabowoNeruskePakdhe Prabowo Subianto https://t.co/N8lKVNCyFX
NatalyaCro25747,"Sebagai orang yang paling sering mengikuti event pemilu di Indonesia, Prabowo menjadi orang yang sering disalah artikan. #PrabowoNeruskePakdhe Prabowo Subianto #PrabowoMenjagaKerukunan"
salehrizad34,"Pidato, ide, pikiran dan gagasannya sering wara-wiri di media cetak, televisi dan internet, #PrabowoNeruskePakdhe Prabowo Subianto #PrabowoMenjagaKerukunan"
Priyanto_Subekt,"Oleh sebab itulah menurut prabowo, dunia harus belajar pada tradisi asia, yaitu kompromi. #PrabowoNeruskePakdhe Prabowo Subianto #PrabowoMenjagaKerukunan"
ValeryGrif59163,"Oleh sebab itulah menurut prabowo, dunia harus belajar pada tradisi asia, yaitu kompromi. #PrabowoNeruskePakdhe Prabowo Subianto #PrabowoMenjagaKerukunan"
SullivanMc94854,"Prabowo memulai pidatonya dengan sebuah quote ""our small planet"", seolah mengatakan bahwa planet yang kita tinggali ini adalah sebuah planet yg kecil, yang setiap sisinya saling berhubungan dan saling mengetahui. #PrabowoNeruskePakdhe Prabowo Subianto #PrabowoMenjagaKerukunan"
FresintoT,"Sebagai contoh Prabowo memisalkan konflik Ukraina- Rusia yang terjadi diawal 2022 telah merusak rantai pasokan global, menciptakan kemiskinan dan kelaparan di tingkat global. #PrabowoNeruskePakdhe Prabowo Subianto #PrabowoMenjagaKerukunan"
ValeryGrif59163,"Sebagai contoh Prabowo memisalkan konflik Ukraina- Rusia yang terjadi diawal 2022 telah merusak rantai pasokan global, menciptakan kemiskinan dan kelaparan di tingkat global. #PrabowoNeruskePakdhe Prabowo Subianto #PrabowoMenjagaKerukunan"
ValeryGrif59163,Kecilnya planet ini membuat setiap konflik yang dilakukan oleh dua kelompok yang bermusuhan selalu memberi dampat bagi semua tatanan kehidupan yang ada di diplanet tersebut. #PrabowoNeruskePakdhe Prabowo Subianto #PrabowoMenjagaKerukunan
HugaryYate74872,"Sebagai contoh Prabowo memisalkan konflik Ukraina- Rusia yang terjadi diawal 2022 telah merusak rantai pasokan global, menciptakan kemiskinan dan kelaparan di tingkat global. #PrabowoNeruskePakdhe Prabowo Subianto #PrabowoMenjagaKerukunan"
HugaryYate74872,Kecilnya planet ini membuat setiap konflik yang dilakukan oleh dua kelompok yang bermusuhan selalu memberi dampat bagi semua tatanan kehidupan yang ada di diplanet tersebut. #PrabowoNeruskePakdhe Prabowo Subianto #PrabowoMenjagaKerukunan
ParksNatha6733,"Pidato, ide, pikiran dan gagasannya sering wara-wiri di media cetak, televisi dan internet, #PrabowoNeruskePakdhe Prabowo Subianto #PrabowoMenjagaKerukunan"
fachriman13,"“Pokoknya yang akan ikut program kita dengan kurikulum kita, dengan standar yang sudah kita tetapkan, dan bersama anak-anak kita,” katanya.#PrabowoNeruskePakdhe Prabowo Subianto"
fachriman13,"“Untuk tahun ini kita lihat perkembangan, harapan bisa tiap tahun dan ini adalah (beasiswa) penuh termasuk gaya hidup,” ujar Prabowo. #PrabowoNeruskePakdhe Prabowo Subianto"
fachriman13,"Ia berharap, program beasiswa yang akan dimulai pada Juli mendatang dapat terus berkelanjutan di setiap tahun. #PrabowoNeruskePakdhe Prabowo Subianto"
fachriman13,"Prabowo menjelaskan, pelajar Palestina yang mendapatkan kesempatan belajar di Universitas Pertahanan akan mendapatkan beasiswa penuh yang mencakup biaya hidup selama di Indonesia. #PrabowoNeruskePakdhe Prabowo Subianto"
fachriman13,"Baik di bidang kedokteran, farmasi, teknik dan MIPA, teknik sipil dan sebagainya,"" ujarnya.  #PrabowoNeruskePakdhe Prabowo Subianto"
fachriman13,"""Programnya tahun ini kalau enggak salah 22 pemuda dan pemudi Palestina yang akan diseleksi Palestina dan Universitas Pertahanan. #PrabowoNeruskePakdhe Prabowo Subianto"
fachriman13,Mereka kemudian menempuh pendidikan di berbagai bidang di Unhan. #PrabowoNeruskePakdhe Prabowo Subianto
fachriman13,"Prabowo mengatakan, di tahun ini program beasiswa itu akan diberikan kepada 22 pelajar Palestina melalui tahapan seleksi. #PrabowoNeruskePakdhe Prabowo Subianto"
fachriman13,"""Kerja sama meliputi beasiswa untuk pemuda dan pemudi Palestina, untuk menjadi siswa di Universitas Pertahanan,"" kata Prabowo kepada wartawan di Kantor Kemhan, Jakarta Pusat, Senin, 19 Juni 2023. #PrabowoNeruskePakdhe Prabowo Subianto"
fachriman13,Perjanjian kerja sama ini ditandatangani langsung Rektor Unhan Laksmana Madya Amarulla Octavian dan Duta Besar (Dubes) Palestina untuk Indonesia Zuhair Al-Shun dan disaksikan Menhan Prabowo Subianto. #PrabowoNeruskePakdhe Prabowo Subianto
fachriman13,Kerja sama itu berupa pemberian beasiswa bagi pelajar Palestina yang menempuh pendidikan di Unhan. #PrabowoNeruskePakdhe Prabowo Subianto
fachriman13,Universitas Pertahanan (Unhan) melalui Kementerian Pertahanan (Kemhan) resmi menjalin kerja sama dengan Palestina. #PrabowoNeruskePakdhe Prabowo Subianto
fachriman13,"Menhan Prabowo Kukuhkan Kerja Sama Unhan-Palestina, Ada Program Beasiswa 

https://t.co/ZgvVRXx2Ou 

#PrabowoNeruskePakdhe Prabowo Subianto"
FresintoT,Kecilnya planet ini membuat setiap konflik yang dilakukan oleh dua kelompok yang bermusuhan selalu memberi dampat bagi semua tatanan kehidupan yang ada di diplanet tersebut. #PrabowoNeruskePakdhe Prabowo Subianto #PrabowoMenjagaKerukunan
Priyanto_Subekt,"Sebagai contoh Prabowo memisalkan konflik Ukraina- Rusia yang terjadi diawal 2022 telah merusak rantai pasokan global, menciptakan kemiskinan dan kelaparan di tingkat global. #PrabowoNeruskePakdhe Prabowo Subianto #PrabowoMenjagaKerukunan"
salehrizad34,"Sebagai orang yang paling sering mengikuti event pemilu di Indonesia, Prabowo menjadi orang yang sering disalah artikan. #PrabowoNeruskePakdhe Prabowo Subianto #PrabowoMenjagaKerukunan"
HamptonRil86253,Kompromi adalah upaya untuk mendapat kesepakatan dari setiap pihak yang memiliki perbedaan pendapat atau selisih paham. #PrabowoNeruskePakdhe Prabowo Subianto #PrabowoMenjagaKerukunan
Priyanto_Subekt,Kecilnya planet ini membuat setiap konflik yang dilakukan oleh dua kelompok yang bermusuhan selalu memberi dampat bagi semua tatanan kehidupan yang ada di diplanet tersebut. #PrabowoNeruskePakdhe Prabowo Subianto #PrabowoMenjagaKerukunan
ValeryGrif59163,"Prabowo memulai pidatonya dengan sebuah quote ""our small planet"", seolah mengatakan bahwa planet yang kita tinggali ini adalah sebuah planet yg kecil, yang setiap sisinya saling berhubungan dan saling mengetahui. #PrabowoNeruskePakdhe Prabowo Subianto #PrabowoMenjagaKerukunan"
SubchanBecam,@StefanAntonio__ @Verraagustian_ H. Letjend ( Pur) TNI Prabowo Subianto
HugaryYate74872,"Prabowo memulai pidatonya dengan sebuah quote ""our small planet"", seolah mengatakan bahwa planet yang kita tinggali ini adalah sebuah planet yg kecil, yang setiap sisinya saling berhubungan dan saling mengetahui. #PrabowoNeruskePakdhe Prabowo Subianto #PrabowoMenjagaKerukunan"
prabowomenyapa8,Sistem Ekonomi Kita Rapuh #KitaPrabowo #Prabowo #PrabowoSubianto https://t.co/6lv0uCVM0V
harrispradana_,"""Terima kasih saya ingin pamit, Mas Wali saya mohon pamit."" kata Prabowo. #PrabowoNeruskePakdhe Prabowo Subianto"
prabowomenyapa8,"Indonesia Kuat, Indonesia Bersih, Indonesia Mandiri. #KitaPrabowo #Prabowo #PrabowoSubianto https://t.co/CYynjoffH2"
harrispradana_,Gibran pun membenarkan jika dirinya sempat berbincang dengan bakal calon Presiden itu. #PrabowoNeruskePakdhe Prabowo Subianto
harrispradana_,"Pada kesempatan itu, Gibran dan Prabowo Subianto beberapa kali terlihat saling berbincang. #PrabowoNeruskePakdhe Prabowo Subianto"
ParksNatha6733,"Sebagai orang yang paling sering mengikuti event pemilu di Indonesia, Prabowo menjadi orang yang sering disalah artikan. #PrabowoNeruskePakdhe Prabowo Subianto #PrabowoMenjagaKerukunan"
harrispradana_,https://t.co/Cjf9YbRcls - Wali Kota Solo Gibran Rakabuming Raka dan Prabowo Subianto hadir dalam acara Harlah ke-63 PMII. #PrabowoNeruskePakdhe Prabowo Subianto
harrispradana_,Momen Menarik saat Gibran dan Prabowo Subianto Hadir Bersama dalam Acara Harlah PMII ke-63 di Solo https://t.co/9l2WwKSaGN #PrabowoNeruskePakdhe Prabowo Subianto
HugaryYate74872,"Berikut adalah beberapa kutipan ide dan gagasan beliau yang saya nukil dari pidatonya di Forum Dialog The 20th Asian Summit IISS Shangri-La 2023, tentang perdamaian dunia. #PrabowoNeruskePakdhe Prabowo Subianto #PrabowoMenjagaKerukunan"
harrispradana_,""" kata Prabowo di hadapan massa PMII yang hadir di Benteng Vastenburg, Solo, Jumat (23/6). #PrabowoNeruskePakdhe Prabowo Subianto"
harrispradana_,"""Mas Wali saya ingin pamit, ini pemimpin hari ini dan pemimpin masa depan, #PrabowoNeruskePakdhe Prabowo Subianto"
harrispradana_,Prabowo lalu memanggil Gibran untuk berpamitan dan menyebut Gibran sebagai pemimpin di masa depan. #PrabowoNeruskePakdhe Prabowo Subianto
harrispradana_,Awalnya Prabowo hendak pamit usai memberikan sambutan di harlah PPMI. #PrabowoNeruskePakdhe Prabowo Subianto
harrispradana_,Hal tersebut diungkapkan Prabowo di hadapan massa Pergerakan Mahasiswa Islam Indonesia (PMII). #PrabowoNeruskePakdhe Prabowo Subianto
Harumiii_kn,"""Kedua, memimpin Nusantara, karena kita sebagai pemuda menjadi embrio pemimpin Indonesia yang akan datang.”  #PrabowoNeruskePakdhe Prabowo Subianto"
Harumiii_kn,"Mulai dari pra kemerdekaan dan pasca kemerdekaan, reformasi dan seterusnya, pasti yang menjadi penggerak di semua lini adalah organisasi mahasiswa.  #PrabowoNeruskePakdhe Prabowo Subianto"
Harumiii_kn,"Alasannya, dari semua sirkulasi pergerakan di Indonesia, pemuda adalah motor penggerak. Terlebih pemuda terdiri yang memiliki latar belakang mahasiswa.  #PrabowoNeruskePakdhe Prabowo Subianto"
